{
  "$schema": "https://json-schema.org/draft/2020-12/schema",
  "$id": "https://realize-project.local/schema/map-selection.schema.json",
  "title": "map-selection（Feature 10 · Stage B 选择轨迹）",
  "description": "对 Semantic Inventory 每一条的选择交代：它被表达了吗、用什么结构承载。**这是 generation evidence，不是 Framework Map Contract 的一部分**；check-map 不读它，契约也不描述它。它的唯一用途是让『AI 为什么把某个语义放进图、为什么没放』第一次可审计，并支撑 E2/E3/E4 的归因。",
  "type": "object",
  "required": ["selectionVersion", "document", "inventoryRef", "dispositions"],
  "additionalProperties": false,

  "properties": {
    "selectionVersion": { "type": "integer", "const": 1 },
    "document": { "$ref": "#/$defs/document" },
    "inventoryRef": { "$ref": "#/$defs/inventoryRef" },
    "dispositions": {
      "type": "array",
      "minItems": 1,
      "description": "Inventory 里每一条必须**恰好出现一次**。完整性由 runner 校验（duplicate / missing / unknown id 都记为 integrity FAIL）；**不自动补**。",
      "items": { "$ref": "#/$defs/disposition" }
    }
  },

  "$defs": {
    "document": {
      "type": "object",
      "required": ["title", "sourcePath"],
      "additionalProperties": false,
      "properties": {
        "title": { "type": "string", "minLength": 1 },
        "sourcePath": { "type": "string", "minLength": 1 }
      }
    },

    "inventoryRef": {
      "type": "object",
      "required": ["path", "sha256"],
      "additionalProperties": false,
      "properties": {
        "path": { "type": "string", "minLength": 1 },
        "sha256": { "type": "string", "minLength": 16 },
        "itemCount": { "type": "integer", "minimum": 1 }
      }
    },

    "disposition": {
      "type": "object",
      "required": ["semanticId", "disposition", "target", "reason"],
      "additionalProperties": false,
      "properties": {
        "semanticId": { "type": "string", "pattern": "^S-[0-9]{2,3}$" },

        "disposition": {
          "enum": ["represented", "topic-only", "omitted"],
          "description": "represented = 由某个 semantic-bearing 结构承载；topic-only = 只在 Topic 命题/导航里出现（图上不可导航）；omitted = 未表达（reason 必填；且不得用于失败路径/权限边界/阈值上限/不变量/非目标五类）。"
        },

        "target": {
          "description": "**强类型引用**：kind 直接支撑 E3（编码到错误位置）/ E4（借自由位逃避）的归因。represented → {kind: element|constraint|attachment|edge, id}；topic-only → {kind: topic, id}；omitted → null。",
          "oneOf": [
            { "type": "null" },
            { "$ref": "#/$defs/target" }
          ]
        },

        "reason": {
          "type": "string",
          "minLength": 4,
          "description": "必须写具体（引用原文机制），不要写『已涵盖』这类空话"
        }
      }
    },

    "target": {
      "type": "object",
      "required": ["kind", "id"],
      "additionalProperties": false,
      "properties": {
        "kind": {
          "enum": ["element", "constraint", "attachment", "edge", "topic"],
          "description": "element/constraint = framework-map 的 element id（constraint 是 type=constraint 的 element）；attachment = 该 attachment 的 elementId（framework-map 的 attachments[] 没有独立 id）；edge = 该边的 id，没有 id 时用 \"<from> --<type>--> <to>\"；topic = topic id。"
        },
        "id": { "type": "string", "minLength": 1 }
      }
    }
  }
}
