{
  "selectionVersion": 1,
  "document": {
    "title": "Goal / Plan / Stage / Task target model contract",
    "sourcePath": "测试文档/fixture-d-goal-plan-task-state-model.md"
  },
  "inventoryRef": {
    "path": "测试文档/fixture-d-goal-plan-task-state-model.md",
    "sha256": "0000000000000000000000000000000000000000000000000000000000000000",
    "itemCount": 154
  },
  "dispositions": [
    {
      "semanticId": "S-01",
      "disposition": "represented",
      "target": {
        "kind": "constraint",
        "id": "C-DocumentScope"
      },
      "reason": "文档定位与 source-of-truth 规则由 C-DocumentScope 承载，并挂在模型层概念上。"
    },
    {
      "semanticId": "S-02",
      "disposition": "represented",
      "target": {
        "kind": "constraint",
        "id": "C-F40NonGoals"
      },
      "reason": "F40 不删除 DailyPlan[]、不改 storage key/兼容读取、不实现 AI/planner 重写等非目标由 C-F40NonGoals 承载。"
    },
    {
      "semanticId": "S-03",
      "disposition": "represented",
      "target": {
        "kind": "constraint",
        "id": "C-F41Scope"
      },
      "reason": "F41 只在纯 models/ 层实现目标新增，planner/replanner/AI/storage/UI/DailyPlan 删除属后续工作，由 C-F41Scope 承载。"
    },
    {
      "semanticId": "S-04",
      "disposition": "represented",
      "target": {
        "kind": "constraint",
        "id": "C-CoreChain"
      },
      "reason": "Goal+UserProfile→InitialPlanContext→PlanBundle 的核心链路由 C-CoreChain 作为约束表达，并连接对应 artifact。"
    },
    {
      "semanticId": "S-05",
      "disposition": "represented",
      "target": {
        "kind": "constraint",
        "id": "C-ReplanChain"
      },
      "reason": "重规划链路与 ReplanContext 装配规则由 C-ReplanChain 承载，并被 ReplanContext 侧挂。"
    },
    {
      "semanticId": "S-06",
      "disposition": "represented",
      "target": {
        "kind": "element",
        "id": "E-Goal"
      },
      "reason": "Goal 是原始目标意图与目标级硬约束，由 E-Goal 元素直接承载。"
    },
    {
      "semanticId": "S-07",
      "disposition": "represented",
      "target": {
        "kind": "element",
        "id": "E-UserProfile"
      },
      "reason": "UserProfile 是跨目标用户上下文与表达/排期偏好，由 E-UserProfile 元素承载。"
    },
    {
      "semanticId": "S-08",
      "disposition": "represented",
      "target": {
        "kind": "constraint",
        "id": "C-CoreChain"
      },
      "reason": "InitialPlanContext 与 ReplanContext 是瞬态输入而非持久真值，由 C-CoreChain 的 transient 规则承载。"
    },
    {
      "semanticId": "S-09",
      "disposition": "represented",
      "target": {
        "kind": "element",
        "id": "E-PlanBundle"
      },
      "reason": "PlanBundle 是核心持久化规划聚合，由 E-PlanBundle 元素承载。"
    },
    {
      "semanticId": "S-10",
      "disposition": "represented",
      "target": {
        "kind": "constraint",
        "id": "C-ReplanPreservation"
      },
      "reason": "DailyReview 是执行事实且重规划不得改写，由 C-ReplanPreservation 承载。"
    },
    {
      "semanticId": "S-11",
      "disposition": "represented",
      "target": {
        "kind": "constraint",
        "id": "C-DailyPlanLegacy"
      },
      "reason": "DailyPlan[] 不属于未来核心模型、仅 legacy 兼容且待独立破坏性迁移移除，由 C-DailyPlanLegacy 承载。"
    },
    {
      "semanticId": "S-12",
      "disposition": "represented",
      "target": {
        "kind": "element",
        "id": "E-ModelLayers"
      },
      "reason": "四层模型划分由 E-ModelLayers 概念元素承载，并通过 attachments 挂在 PlanBundle 上。"
    },
    {
      "semanticId": "S-13",
      "disposition": "represented",
      "target": {
        "kind": "constraint",
        "id": "C-InitialContextRules"
      },
      "reason": "初始规划不得依赖 DailyReview 的前置条件由 C-InitialContextRules 承载。"
    },
    {
      "semanticId": "S-14",
      "disposition": "represented",
      "target": {
        "kind": "constraint",
        "id": "C-InitialContextRules"
      },
      "reason": "InitialPlanContext 由 service 运行时组装、只含首计划前数据、不长期存储，由 C-InitialContextRules 承载。"
    },
    {
      "semanticId": "S-15",
      "disposition": "represented",
      "target": {
        "kind": "constraint",
        "id": "C-AIValidation"
      },
      "reason": "DeepSeek 压缩 schema 与 AI 输出必须校验后才能成为 PlanBundle，由 C-AIValidation 承载。"
    },
    {
      "semanticId": "S-16",
      "disposition": "represented",
      "target": {
        "kind": "element",
        "id": "E-Replanning"
      },
      "reason": "现实与计划背离时重规划更新或替换计划，由 E-Replanning 过程元素承载。"
    },
    {
      "semanticId": "S-17",
      "disposition": "represented",
      "target": {
        "kind": "constraint",
        "id": "C-ReplanTriggers"
      },
      "reason": "拒绝计划、反馈、Stage 完成、日回顾、产能/截止变化、计划不可行等触发条件由 C-ReplanTriggers 承载。"
    },
    {
      "semanticId": "S-18",
      "disposition": "represented",
      "target": {
        "kind": "constraint",
        "id": "C-ReplanChain"
      },
      "reason": "currentPlanBundle 由 service 从 storage 读取并注入 ReplanContext，由 C-ReplanChain 承载。"
    },
    {
      "semanticId": "S-19",
      "disposition": "represented",
      "target": {
        "kind": "constraint",
        "id": "C-ReplanChain"
      },
      "reason": "ReplanContext 是瞬态输入、不是持久真值来源，由 C-ReplanChain 承载。"
    },
    {
      "semanticId": "S-20",
      "disposition": "represented",
      "target": {
        "kind": "element",
        "id": "E-ReplanAiInput"
      },
      "reason": "AI replanner 接收从 ReplanContext 派生的 ReplanAiInput，由 E-ReplanAiInput 元素承载。"
    },
    {
      "semanticId": "S-21",
      "disposition": "represented",
      "target": {
        "kind": "constraint",
        "id": "C-ReplanPreservation"
      },
      "reason": "重规划必须保留已完成任务事实与历史 DailyReview[]，由 C-ReplanPreservation 承载。"
    },
    {
      "semanticId": "S-22",
      "disposition": "represented",
      "target": {
        "kind": "constraint",
        "id": "C-ReplanPreservation"
      },
      "reason": "重规划不得静默丢弃未完成任务，由 C-ReplanPreservation 承载。"
    },
    {
      "semanticId": "S-23",
      "disposition": "represented",
      "target": {
        "kind": "constraint",
        "id": "C-ReplanInfeasible"
      },
      "reason": "无法在截止前产出可行计划时必须返回显式 infeasible 结果，由 C-ReplanInfeasible 承载。"
    },
    {
      "semanticId": "S-24",
      "disposition": "represented",
      "target": {
        "kind": "element",
        "id": "E-Goal"
      },
      "reason": "Goal 回答想要什么、什么算完成、截止日期、可分配时间，由 E-Goal 元素承载。"
    },
    {
      "semanticId": "S-25",
      "disposition": "represented",
      "target": {
        "kind": "constraint",
        "id": "C-GoalFields"
      },
      "reason": "F40 为 Goal 新增 originalInput/successCriteria/scopeNotes/startingPoint/constraints，由 C-GoalFields 承载。"
    },
    {
      "semanticId": "S-26",
      "disposition": "represented",
      "target": {
        "kind": "constraint",
        "id": "C-F65Extensions"
      },
      "reason": "F65 preferredApproach 与 adjustmentRisk 的附加扩展由 C-F65Extensions 承载。"
    },
    {
      "semanticId": "S-27",
      "disposition": "represented",
      "target": {
        "kind": "element",
        "id": "E-PlanAdjustmentRisk"
      },
      "reason": "adjustmentRisk 仅在 needs_adjustment 时存在及 legacy 回退 infeasible，由 E-PlanAdjustmentRisk 状态元素承载。"
    },
    {
      "semanticId": "S-28",
      "disposition": "represented",
      "target": {
        "kind": "constraint",
        "id": "C-GoalBoundaries"
      },
      "reason": "preferredApproach 来源限定及不得从 MBTI/塔罗/状态卡/行为画像推断，由 C-GoalBoundaries 承载。"
    },
    {
      "semanticId": "S-29",
      "disposition": "represented",
      "target": {
        "kind": "constraint",
        "id": "C-GoalBoundaries"
      },
      "reason": "preferredApproach 不覆盖 deadline、daily capacity 或显式硬约束，由 C-GoalBoundaries 承载。"
    },
    {
      "semanticId": "S-30",
      "disposition": "represented",
      "target": {
        "kind": "constraint",
        "id": "C-GoalFields"
      },
      "reason": "Goal 各字段语义由 C-GoalFields 统一承载，并侧挂到 E-Goal。"
    },
    {
      "semanticId": "S-31",
      "disposition": "represented",
      "target": {
        "kind": "constraint",
        "id": "C-GoalBoundaries"
      },
      "reason": "被拒绝归入 Goal 的 MBTI/塔罗/表达风格、每日反馈、计划策略、页面文案由 C-GoalBoundaries 承载。"
    },
    {
      "semanticId": "S-32",
      "disposition": "represented",
      "target": {
        "kind": "constraint",
        "id": "C-GoalUniqueness"
      },
      "reason": "一个 Goal 可有多个历史 Plan 版本但同一时刻至多一个 active plan，由 C-GoalUniqueness 承载。"
    },
    {
      "semanticId": "S-33",
      "disposition": "represented",
      "target": {
        "kind": "constraint",
        "id": "C-DailyAvailableMinutes"
      },
      "reason": "dailyAvailableMinutes 是 goal-scoped 规划约束且必须为正整数，由 C-DailyAvailableMinutes 承载。"
    },
    {
      "semanticId": "S-34",
      "disposition": "represented",
      "target": {
        "kind": "constraint",
        "id": "C-DailyAvailableMinutes"
      },
      "reason": "dailyAvailableMinutes 是每日预算而非用户每日工作承诺，由 C-DailyAvailableMinutes 承载。"
    },
    {
      "semanticId": "S-35",
      "disposition": "represented",
      "target": {
        "kind": "constraint",
        "id": "C-F58Creation"
      },
      "reason": "F58 从目标措辞、deadline、daily budget 开始，taskType/successCriteria/startingPoint 仅在显式抽取/澄清/假设时加入，由 C-F58Creation 承载。"
    },
    {
      "semanticId": "S-36",
      "disposition": "represented",
      "target": {
        "kind": "constraint",
        "id": "C-GoalCompletionCancellation"
      },
      "reason": "Goal 完成在 goal 级判定而非单任务自动完成，由 C-GoalCompletionCancellation 承载。"
    },
    {
      "semanticId": "S-37",
      "disposition": "represented",
      "target": {
        "kind": "constraint",
        "id": "C-GoalCompletionCancellation"
      },
      "reason": "Goal 取消必须显式处理相关 Plan/Stage/Task/Review 记录，由 C-GoalCompletionCancellation 承载。"
    },
    {
      "semanticId": "S-38",
      "disposition": "represented",
      "target": {
        "kind": "element",
        "id": "E-UserProfile"
      },
      "reason": "UserProfile 回答用户通常如何工作或接收任务表达，由 E-UserProfile 元素承载。"
    },
    {
      "semanticId": "S-39",
      "disposition": "represented",
      "target": {